{
 "schema": "ccc.auto-distill.evaluation-receipt.v1",
 "pipeline": 6,
 "subject": {
  "path": "scripts/auto-distill/auto-distill.py",
  "sha256": "bf16022640bfd7146408dea1db1841ffe33d010c67c1c65c405159f577903c1a",
  "surface_schema": "ccc.auto-distill.canon-surface.v1",
  "surface_sha256": "be987eac04cc4bbc1429ebbf9eae6e4c7243e189e17ef34de7ae1214cc25297c",
  "surface_members": [
   "assign:PIPELINE",
   "assign:CANON_PROMPT",
   "assign:CANON_EXCLUDE",
   "assign:_FOCUS_WORD_RE",
   "assign:TOKEN_RES",
   "assign:SELF_ADDR_RE",
   "function:unwrap_claude_envelope",
   "function:extract_json",
   "function:_focus_needles",
   "function:_needle_score",
   "function:_window_body",
   "function:section_body",
   "function:literal_hits",
   "function:self_canon_addrs",
   "function:format_self_canon",
   "function:self_canon_sections",
   "function:canon_snippets",
   "function:canon_dedup"
  ]
 },
 "evaluation": {
  "id": "TM-3657",
  "evaluated_source_sha256": "bf16022640bfd7146408dea1db1841ffe33d010c67c1c65c405159f577903c1a",
  "completed_at": "2026-10-05T12:30:22Z",
  "provider": "claude-code-oauth",
  "model": "claude-haiku-4-5-20251001",
  "model_resolution": {
   "alias": "claude-haiku-4-5-20251001",
   "resolved_id": "claude-haiku-4-5-20251001",
   "resolved_by": "claude-json-modelUsage:envelopes (47/47 calls)",
   "resolved_at": "2026-10-05T12:30:22Z"
  },
  "corpus": {
   "sample": "sample-v4.json",
   "sample_md5": "d10ab0338da57f0f83e4f7123fece1cd",
   "sample_sha256": "56e349d2ba79f5e9395957eb53af14f8d3c0ab862a0100c72229e63bd2388c16",
   "verdicts": "verdicts.json",
   "verdicts_md5": "886a4840289163898a9d7ff1e6d7b5d2",
   "verdicts_sha256": "f496bb33a8507e62f6f1099397478f99dae68d52b27aa773f11f53bd4b73da1e",
   "cases": 47
  },
  "harness": {
   "eval_canon_sha256": "fb6a49d72e003254c3f0ddf093f6864d5e40c6f03ae04b83349c520ee4321716",
   "recheck_addr_sha256": "698599263790d4826416b6a6474d2a572d6791178488773990ecc433d011df5e"
  },
  "artifacts": {
   "eval_log_sha256": "360a16ec7cc18b27866be6212374e89da67c7d832f241712d698f9766e6bc693",
   "eval_result_sha256": "aa5fbf2b8ff4da34c59c4a7a4233dabf753219f11b8a7c7f35d05a02a1421cae",
   "recheck_log_sha256": "643f9ab824e204cad2437fe8dc57c8d1189efaa27da5991dc53acb60c1a95fb2"
  },
  "recheck": {
   "baseline_duplicates": 1,
   "duplicates": 7,
   "cases": 12,
   "suspect": 0
  },
  "confusion": {
   "tp": 13,
   "fp": 2,
   "fn": 10,
   "tn": 22
  },
  "collateral_damage": 0,
  "passed": true
 },
 "issued_at": "2026-10-05T21:31:54+09:00"
}
